content_id,content_old_id,content_name,content_description,views,reads,date_Data
46460,8901,Anemia in CKD,"Anemia is a common complication in chronic kidney disease (CKD), affecting a significant portion of patients with advanced stages. It primarily results from decreased erythropoietin production by the kidneys, which is essential for red blood cell production.1 Additionally, CKD often leads to iron deficiency, inflammation, and shortened red blood cell lifespan, all contributing to anemia. Symptoms include fatigue, weakness, and pallor. Management includes erythropoiesis-stimulating agents (ESAs) to stimulate red blood cell production, alongside iron supplementation to address iron deficiency.2 In some cases, blood transfusions may be necessary. Early detection and treatment are crucial to improving quality of life and preventing complications like cardiovascular disease. Regular monitoring of hemoglobin levels is important for optimal management in CKD patients.",287,34,"0,0,0,0,0,0,0"
46461,8902,Hypertension in CKD,"Chronic kidney disease (CKD) and hypertension (HTN) have a complex, bidirectional relationship as declining kidney function increases blood pressure, while persistent hypertension worsens CKD. This cycle is well established in clinical and experimental research. In the Chronic Renal Insufficiency Cohort (CRIC) study of 3612 adults with CKD, 86 percent had hypertension compared to 29 percent in the general population. As CKD progresses, hypertension becomes more common and difficult to control.[1]Intensive blood pressure lowering reduces kidney failure risk by 17 percent and end stage kidney disease by 18 percent, especially in those with proteinuria.&nbsp;[2]Management includes addressing renal pathology, setting blood pressure targets, and using lifestyle and medical therapies.Reference(s):1.&nbsp;https://pmc.ncbi.nlm.nih.gov/articles/PMC4445132/2.&nbsp;https://pmc.ncbi.nlm.nih.gov/articles/PMC3735743/",86,24,"0,0,0,0,0,0,0"
46462,8903,Nutritional Management of Chronic Kidney Disease and Dialysis,"Chronic kidney disease (CKD) is a global public health issue affecting approximately 5%–15% of the population, with a growing number progressing to end-stage renal disease (ESRD) requiring dialysis.[1]&nbsp;Nutritional management plays a critical role across all stages of CKD. Early intervention targets modifiable risk factors such as obesity, diabetes, and hypertension through dietary adjustments, including reduced salt intake, increased fruits and vegetables, and lower saturated fat consumption. As eGFR declines, patients may develop dyslipidemia, anemia, and acidosis, requiring reduced animal protein intake, increased consumption of unsaturated fats and whole grains, and careful fluid management. In advanced stages of kidney failure, malnutrition, inflammation, and mineral-bone disorder become major concerns. Nutritional strategies include limiting fluid intake and dietary phosphate, optimizing protein quality and quantity, and introducing oral nutrition supplements when intake or weight declines. Tailored dietary approaches, along with regular monitoring, are essential to slow CKD progression and improve patient outcomes.[2]Reference(s):1.&nbsp;https://pmc.ncbi.nlm.nih.gov/articles/PMC5372871/2.&nbsp;https://www.ajkd.org/article/S0272-6386(21)00764-2/fulltext&nbsp;",1075,313,"0,0,0,0,0,0,0"
46821,9161,Hypertension in CKD,"Chronic kidney disease (CKD) and hypertension (HTN) have a complex, bidirectional relationship as declining kidney function increases blood pressure, while persistent hypertension worsens CKD. This cycle is well established in clinical and experimental research. In the Chronic Renal Insufficiency Cohort (CRIC) study of 3612 adults with CKD, 86 percent had hypertension compared to 29 percent in the general population. As CKD progresses, hypertension becomes more common and difficult to control.[1]&nbsp;Intensive blood pressure lowering reduces kidney failure risk by 17 percent and end stage kidney disease by 18 percent, especially in those with proteinuria.&nbsp;[2]&nbsp;Management includes addressing renal pathology, setting blood pressure targets, and using lifestyle and medical therapies.Reference(s):1.&nbsp;https://pmc.ncbi.nlm.nih.gov/articles/PMC4445132/&nbsp;2.&nbsp;https://pmc.ncbi.nlm.nih.gov/articles/PMC3735743/",774,232,"0,0,0,0,0,0,0"
46823,9162,Anaemia in CKD,"Anaemia is a common complication in chronic kidney disease (CKD), affecting a significant portion of patients with advanced stages. It primarily results from decreased erythropoietin production by the kidneys, which is essential for red blood cell production.[1]&nbsp;Additionally, CKD often leads to iron deficiency, inflammation, and shortened red blood cell lifespan, all contributing to anaemia. Symptoms include fatigue, weakness, and pallor. Management includes erythropoiesis-stimulating agents (ESAs) to stimulate red blood cell production, alongside iron supplementation to address iron deficiency.[2]&nbsp;In some cases, blood transfusions may be necessary. Early detection and treatment are crucial to improving quality of life and preventing complications like cardiovascular disease. Regular monitoring of haemoglobin levels is important for optimal management in CKD patients.Reference(s):1.&nbsp;https://www.frontiersin.org/journals/medicine/articles/10.3389/fmed.2021.642296/full&nbsp;2.&nbsp;https://pmc.ncbi.nlm.nih.gov/articles/PMC9924302/",873,261,"0,0,0,0,0,0,0"
46873,9202,Proteinuria in Chronic Kidney Disease,"Proteinuria, the presence of excess protein in the urine, is a key indicator of kidney damage in chronic kidney disease (CKD). It occurs due to glomerular injury, which increases the permeability of the filtration barrier and allows proteins like albumin to enter the urine.[1]&nbsp;Proteinuria is both a marker of kidney dysfunction and a risk factor for disease progression. The level of proteinuria is directly related to the severity of kidney damage and the risk of progressing to end stage renal disease.&nbsp;[2]&nbsp;Management includes controlling blood pressure, especially with angiotensin converting enzyme inhibitors or angiotensin receptor blockers, along with tight blood sugar control in diabetic patients, lifestyle changes, and regular monitoring of protein levels to evaluate CKD progression and treatment response.Reference(s):1.&nbsp;https://www.nature.com/articles/s41598-024-64833-82.&nbsp;https://pmc.ncbi.nlm.nih.gov/articles/PMC9380095/",810,174,"0,0,0,0,0,0,0"
46876,9204,Challenges and Best Practices for Managing Anemia in Non-Dialysis Chronic Kidney Disease,"Chronic kidney disease (CKD) is extremely common and has emerged as one of the leading non-communicable causes of death worldwide. It has been substantiated that approximately 1 in 10 individuals are affected by CKD. Anemia is a common complication in CKD, and is associated with a reduced quality of life, and an increased morbidity and mortality.[1]&nbsp;In CKD, anemia develops when the glomerular filtration rate (GFR) decreases to &lt; 60 mL/min/1.73 m2. With CKD disease progression, the prevalence of anemia increases. Common symptoms of anemia in CKD include dyspnea, fatigue, generalized weakness, headache, decreased concentration, dizziness, and reduced exercise tolerance. Moreover, up to 60% of patients with non-dialysis dependent CKD develop anemia and around 50% of patients with non-dialysis dependent CKD have iron deficiency.&nbsp;Reference(s):1.&nbsp;https://pmc.ncbi.nlm.nih.gov/articles/PMC8032930/&nbsp;",1258,289,"0,0,0,0,0,0,0"
46878,9206,Anemia in CKD,"Anemia is a common complication in chronic kidney disease (CKD), affecting a significant portion of patients with advanced stages. It primarily results from decreased erythropoietin production by the kidneys, which is essential for red blood cell production.[1]&nbsp;Additionally, CKD often leads to iron deficiency, inflammation, and shortened red blood cell lifespan, all contributing to anemia. Symptoms include fatigue, weakness, and pallor. Management includes erythropoiesis-stimulating agents (ESAs) to stimulate red blood cell production, alongside iron supplementation to address iron deficiency.[2]&nbsp;In some cases, blood transfusions may be necessary. Early detection and treatment are crucial to improving quality of life and preventing complications like cardiovascular disease. Regular monitoring of hemoglobin levels is important for optimal management in CKD patients.Reference(s):1.&nbsp;https://www.frontiersin.org/journals/medicine/articles/10.3389/fmed.2021.642296/full2.&nbsp;https://pmc.ncbi.nlm.nih.gov/articles/PMC9924302/",768,232,"0,0,0,0,0,0,0"
46880,9208,Conventional and Novel Therapies for Treating Iron Deficiency Anemia in ND-CKD,"Iron deficiency anemia (IDA) is a common complication in non-dialysis chronic kidney disease (ND-CKD) patients, often exacerbated by inflammation and impaired iron utilization. Treatment strategies involve identifying absolute vs. functional iron deficiency using indicators like TSAT and ferritin levels.[1]&nbsp;Conventional therapies include oral iron supplements and intravenous (IV) iron, but these come with risks such as iron overload and oxidative stress. Novel therapies include Ferric citrate (FC), which regulates iron absorption and is FDA-approved for ND-CKD patients, Ferric maltol for patients with inflammatory bowel disease, and Ferric pyrophosphate citrate (FPC), which is delivered via dialysate for hemodialysis patients. Liposomal and Sucrosomial iron offer promising results by bypassing the gastrointestinal tract, reducing side effects, and improving hemoglobin levels.[2]&nbsp;These emerging therapies provide safer, more effective alternatives for managing IDA in CKD.Reference(s):1.&nbsp;https://karger.com/aha/article-abstract/142/1/44/15533/Iron-Deficiency-Anemia-in-Chronic-Kidney-Disease?redirectedFrom=fulltext2.&nbsp;https://pmc.ncbi.nlm.nih.gov/articles/PMC10305423/",607,170,"0,0,0,0,0,0,0"
49489,10398,Acute Kidney Injury,"Acute kidney injury (AKI) is defined as an abrupt (within hours) reduction in kidney function, which encompasses both injury (structural damage) and impairment (loss of function). Many patients with AKI have a mixed etiology where sepsis, ischemic, and nephrotoxicity often co-exist and complicate recognition and treatment.[1]&nbsp;Common signs and symptoms of AKI include decreased urine output, edema, dyspnea, fatigue, and loss of appetite. Hyperkalemia, hyponatremia, and intravascular overload are common complications of AKI. Management is based on treating the underlying cause of AKI, but supportive care—via fluid management, vasopressor therapy, kidney replacement therapy (KRT), and more—is also crucial.[2]Reference(s):1.&nbsp;https://pmc.ncbi.nlm.nih.gov/articles/PMC5198510/#sec152.&nbsp;https://pmc.ncbi.nlm.nih.gov/articles/PMC11084889/",792,37,"0,0,0,1,1,0,0"
49493,10399,Proteinuria in Chronic Kidney Disease,"Proteinuria, the presence of excess protein in urine, is a significant marker of kidney damage in chronic kidney disease (CKD). It results from glomerular injury, leading to increased permeability of the filtration barrier, allowing proteins like albumin to pass into the urine.[1]&nbsp;Proteinuria is both a sign of kidney dysfunction and a risk factor for disease progression. The amount of proteinuria correlates with the severity of kidney damage and can predict the progression to end-stage renal disease. Managing proteinuria involves controlling blood pressure, particularly with angiotensin-converting enzyme inhibitors (ACE inhibitors) or angiotensin receptor blockers (ARBs), which help reduce protein leakage.[2]&nbsp;Tight glycemic control in diabetic patients and lifestyle modifications are also crucial. Regular monitoring of protein levels is essential for assessing CKD progression and treatment effectiveness.Reference(s):1.&nbsp;https://www.nature.com/articles/s41598-024-64833-82.&nbsp;https://pmc.ncbi.nlm.nih.gov/articles/PMC9380095/",791,39,"0,0,2,1,1,1,1"
49517,10400,Challenges and Best Practices for Managing Anemia in Non-Dialysis Chronic Kidney Diseases Patient,"Chronic kidney disease (CKD) is extremely common and has emerged as one of the leading non-communicable causes of death worldwide. It has been substantiated that approximately 1 in 10 individuals are affected by CKD. Anemia is a common complication in CKD, and is associated with a reduced quality of life, and an increased morbidity and mortality.[1]&nbsp;In CKD, anemia develops when the glomerular filtration rate (GFR) decreases to &lt; 60 mL/min/1.73 m2. With CKD disease progression, the prevalence of anemia increases. Common symptoms of anemia in CKD include dyspnea, fatigue, generalized weakness, headache, decreased concentration, dizziness, and reduced exercise tolerance. Moreover, up to 60% of patients with non-dialysis dependent CKD develop anemia and around 50% of patients with non-dialysis dependent CKD have iron deficiency.Reference(s):1.&nbsp;https://pmc.ncbi.nlm.nih.gov/articles/PMC8032930/",1682,28,"0,0,0,0,0,0,2"
49670,10410,Ferric Carboxymaltose for Oncology Hematology,"Parenteral iron preparations, like Ferric carboxymaltose (FCM), are commonly used to manage moderate-to-severe iron deficiency anemia.[1]&nbsp;FCM is a novel intravenous iron formulation offering rapid correction of iron deficiency anemia and effective iron store replenishment, making it valuable for cancer patients. It delivers up to 1000 mg iron in a single, 15‑minute dose, facilitating swift hemoglobin recovery and improving patient outcomes. FCM demonstrates safety and tolerance comparable to traditional treatments, with fewer gastrointestinal side effects than oral iron. Its controlled-release mechanism reduces free iron-related toxicity. For oncology and hematology patients who often exhibit treatment-related anemia, FCM provides a convenient, efficient, and well-tolerated therapeutic option.Reference(s):1.&nbsp;https://pmc.ncbi.nlm.nih.gov/articles/PMC9189149/",151,14,"7,0,0,0,0,0,0"
49671,10411,Acute Kidney Injury,"Acute kidney injury (AKI) is defined as an abrupt (within hours) reduction in kidney function, which encompasses both injury (structural damage) and impairment (loss of function). Many patients with AKI have a mixed etiology where sepsis, ischemic, and nephrotoxicity often co-exist and complicate recognition and treatment.[1]&nbsp;Common signs and symptoms of AKI include decreased urine output, edema, dyspnea, fatigue, and loss of appetite. Hyperkalemia, hyponatremia, and intravascular overload are common complications of AKI. Management is based on treating the underlying cause of AKI, but supportive care—via fluid management, vasopressor therapy, kidney replacement therapy (KRT), and more—is also crucial.[2]Reference(s):1.&nbsp;https://pmc.ncbi.nlm.nih.gov/articles/PMC5198510/#sec152.&nbsp;https://pmc.ncbi.nlm.nih.gov/articles/PMC11084889/",351,23,"3,12,0,2,1,0,0"
49672,10412,Conventional and Novel Therapies for Treating Iron Deficiency Anemia in ND-CKD,"Iron deficiency anemia (IDA) is a common complication in non-dialysis chronic kidney disease (ND-CKD) patients, often exacerbated by inflammation and impaired iron utilization. Treatment strategies involve identifying absolute vs. functional iron deficiency using indicators like TSAT and ferritin levels.[1]Conventional therapies include oral iron supplements and intravenous (IV) iron, but these come with risks such as iron overload and oxidative stress. Novel therapies include Ferric citrate (FC), which regulates iron absorption and is FDA-approved for ND-CKD patients, Ferric maltol for patients with inflammatory bowel disease, and Ferric pyrophosphate citrate (FPC), which is delivered via dialysate for hemodialysis patients. Liposomal and Sucrosomial iron offer promising results by bypassing the gastrointestinal tract, reducing side effects, and improving hemoglobin levels.[2]&nbsp;These emerging therapies provide safer, more effective alternatives for managing IDA in CKD.Reference(s):1.&nbsp;https://karger.com/aha/article-abstract/142/1/44/15533/Iron-Deficiency-Anemia-in-Chronic-Kidney-Disease?redirectedFrom=fulltext2.&nbsp;https://pmc.ncbi.nlm.nih.gov/articles/PMC10305423/",266,20,"1,5,11,0,0,0,0"
49673,10413,GFR Measurement,"Glomerular filtration rate (GFR) is widely accepted as the best index of kidney function in health and disease, and accurate values are required for optimal decision-making. Estimated GFR has been included in clinical practice guidelines to enable physicians to identify patients with chronic kidney disease (CKD) to enable earlier interventions to slow the progression of the disease.[1]&nbsp;Measured GFR using urinary or plasma clearance of exogenous filtration markers is considered the gold standard for evaluation of kidney function but is not routinely available. Inulin, creatinine, and urea are candidate markers of GFR. Additionally, a number of radiolabelled chelates have been used to assess GFR. It is recommended that CKD be classified based on the GFR category and the albuminuria category.[2]Reference(s):1.&nbsp;https://www.ajkd.org/article/S0272-6386(08)01235-3/fulltext2.&nbsp;https://pmc.ncbi.nlm.nih.gov/articles/PMC4089693/",808,25,"3,1,1,0,4,10,0"
49685,10414,Nephrotic Syndrome,"Nephrotic syndrome is characterized by hypoalbuminemia, severe proteinuria, and peripheral edema, usually in conjunction with hyperlipidemia.[1]&nbsp;The condition may be idiopathic or can originate due to diverse secondary causes. Nephrotic syndrome may also give rise to complications, such as infections, hypocalcemia, bone abnormalities, hyperlipidemia, atherosclerosis, hypercoagulability, and hypovolemia. For diagnosis, blood tests, including serum albumin, total cholesterol and triglycerides, and creatinine assessment, are warranted. Testing for secondary causes is also recommended. Imaging tests include ultrasonography, renal biopsy tests, and autoantibodies against PLAR.[2]&nbsp;Management involves edema control via fluid and dietary restriction coupled with loop diuretics. Hospital admission may be needed for unresponsive patients.Reference(s):1.&nbsp;https://pmc.ncbi.nlm.nih.gov/articles/PMC10924861/2.&nbsp;https://www.ncbi.nlm.nih.gov/books/NBK470444/",466,35,"1,0,5,21,0,0,1"
49686,10415,Conventional and Novel Therapies for Treating Iron Deficiency Anemia in ND-CKD,"Iron deficiency anemia (IDA) is a common complication in non-dialysis chronic kidney disease (ND-CKD) patients, often exacerbated by inflammation and impaired iron utilization. Treatment strategies involve identifying absolute vs. functional iron deficiency using indicators like TSAT and ferritin levels.[1]&nbsp;Conventional therapies include oral iron supplements and intravenous (IV) iron, but these come with risks such as iron overload and oxidative stress. Novel therapies include ferric citrate (FC), which regulates iron absorption and is FDA-approved for ND-CKD patients, ferric maltol for patients with inflammatory bowel disease, and ferric pyrophosphate citrate (FPC), which is delivered via dialysate for hemodialysis patients. Liposomal and Sucrosomial iron offer promising results by bypassing the gastrointestinal tract, reducing side effects, and improving hemoglobin levels.[2]&nbsp;These emerging therapies provide safer, more effective alternatives for managing IDA in CKD.Reference(s):1.&nbsp;https://karger.com/aha/article-abstract/142/1/44/15533/Iron-Deficiency-Anemia-in-Chronic-Kidney-Disease?redirectedFrom=fulltext2.&nbsp;https://pmc.ncbi.nlm.nih.gov/articles/PMC10305423/",1730,28,"0,0,1,2,8,0,0"
44736,35178,Conventional and novel therapies for treating iron deficiency anemia in ND-CKD,"Iron deficiency anemia (IDA) is a common complication in non-dialysis chronic kidney disease (ND-CKD) patients, often exacerbated by inflammation and impaired iron utilization. Treatment strategies involve identifying absolute vs. functional iron deficiency using indicators like TSAT and ferritin levels.[1] Conventional therapies include oral iron supplements and intravenous (IV) iron, but these come with risks such as iron overload and oxidative stress. Novel therapies include ferric citrate (FC), which regulates iron absorption and is FDA-approved for ND-CKD patients, ferric maltol for patients with inflammatory bowel disease, and ferric pyrophosphate citrate (FPC), which is delivered via dialysate for hemodialysis patients. Liposomal and Sucrosomial iron offer promising results by bypassing the gastrointestinal tract, reducing side effects, and improving hemoglobin levels.[2] These emerging therapies provide safer, more effective alternatives for managing IDA in CKD.



Citation



	^ https://karger.com/aha/article-abstract/142/1/44/15533/Iron-Deficiency-Anemia-in-Chronic-Kidney-Disease?redirectedFrom=fulltext&nbsp;
	^ &nbsp;https://pmc.ncbi.nlm.nih.gov/articles/PMC10305423/&nbsp;&nbsp;


",6697,291,"0,0,0,0,0,0,0"
44780,35225,Detection and evaluation of CKD,"Detection and evaluation of chronic kidney disease (CKD) primarily involves assessing glomerular filtration rate (GFR), which is now widely estimated based on serum creatinine levels.[1] Estimated GFR helps assess renal function, severity of disease, appropriate drug dosing, and renal involvement in systemic diseases. Renal function tests, including serum creatinine, plasma urea, urine volume, and minerals in urine, monitor renal damage and help determine the underlying etiology. The ideal GFR marker, such as inulin, is metabolically inert and cleared only by the kidneys.[2] Other markers like creatinine and urea are also used, though each has limitations. While creatinine clearance is useful, it can be inaccurate at low GFR and affected by drugs. Advanced methods, including radiolabeled compounds, can further assess kidney function.



Citation



	^ https://www.annlabmed.org/journal/view.html?uid=3514&amp;vmd=Full
	^ https://pmc.ncbi.nlm.nih.gov/articles/PMC11150208/&nbsp;&nbsp;


",5684,192,"0,0,0,0,0,0,0"
44843,35289,Estimation of GFR and KDIGO classification of CKD,"The estimation of glomerular filtration rate (GFR) is crucial for assessing kidney function. Measured GFR (mGFR) using exogenous markers, like urinary or plasma clearance of filtration substances, is the gold standard but is not routinely used due to its complexity. Renal function tests typically rely on estimated GFR (eGFR) using serum creatinine or creatinine clearance (Clcr), which, despite limitations, remains the most common method.[1] Emerging markers like cystatin C offer potential for improved accuracy and may become routine in the future. The KDIGO classification of chronic kidney disease (CKD) categorizes CKD into stages based on eGFR values, aiding in diagnosis and treatment planning.[2] While exogenous substances provide precise measurements, endogenous markers are being explored for better clinical integration.



Citation



	^ https://www.annlabmed.org/journal/view.html?uid=3514&amp;vmd=Full&nbsp;
	^ https://www.kidney-international.org/article/S0085-2538(23)00766-4/fulltext&nbsp;&nbsp;


",1294,155,"0,0,0,0,0,0,0"
44845,35291,Hypertension management in chronic kidney disease and diabetes,"Hypertension (HTN) and chronic kidney disease (CKD) are closely interconnected, creating a cycle where declining kidney function leads to elevated blood pressure, and sustained hypertension accelerates kidney deterioration.[1] This bidirectional relationship contributes to the progression of both conditions, necessitating effective management strategies. In patients with CKD and diabetes, blood pressure control is critical to slowing kidney function decline and preventing cardiovascular complications. The management of hypertension often includes lifestyle modifications, such as weight loss, dietary changes, and regular exercise, along with pharmacologic interventions like ACE inhibitors, angiotensin receptor blockers (ARBs), and diuretics. Tight blood pressure control, especially below 130/80 mmHg, has been shown to reduce the risk of CKD progression and improve patient outcomes.[2] This requires individualized treatment approaches to address both CKD and diabetes-related factors.



Citation



	^ https://www.magonlinelibrary.com/doi/full/10.12968/hmed.2021.0440&nbsp;
	^ https://www.sciencedirect.com/science/article/pii/S0929664624004431&nbsp;&nbsp;


",461,44,"0,0,0,0,0,0,0"
44846,35292,"CKD screening in type 2 DM: when, why and how?","Chronic kidney disease (CKD) screening in individuals with Type 2 diabetes is essential to prevent progression to end-stage renal disease (ESRD). Diabetic patients are at an increased risk of CKD, yet a significant proportion remain undiagnosed. Early detection is critical, as it allows for timely intervention to slow disease progression.[1] Screening typically involves measuring urinary albumin excretion (UAE), which helps identify early signs of kidney damage. Regular monitoring of UAE and estimated glomerular filtration rate (eGFR) can aid in the early identification of CKD.[2] Screening should begin at diagnosis in Type 2 diabetes and continue annually, as early intervention with lifestyle changes and pharmacologic treatments, such as ACE inhibitors or ARBs, can significantly reduce the risk of ESRD and improve long-term outcomes.



Citation



	^ https://bmcmedicine.biomedcentral.com/articles/10.1186/s12916-022-02438-6&nbsp;
	^ https://www.nature.com/articles/s41598-024-56765-0&nbsp;


",424,44,"0,0,0,0,0,0,0"
